{
  "$schema": "https://json-schema.org/draft/2020-12/schema",
  "title": "FishState",
  "type": "object",
  "required": [
    "fish_id",
    "generation",
    "genome_id",
    "viable",
    "energy",
    "size"
  ],
  "properties": {
    "fish_id": {
      "type": "string"
    },
    "generation": {
      "type": "integer",
      "minimum": 0
    },
    "genome_id": {
      "type": "string"
    },
    "viable": {
      "type": "boolean"
    },
    "energy": {
      "type": "number",
      "minimum": 0,
      "maximum": 1
    },
    "size": {
      "type": "number",
      "minimum": 0
    },
    "fitness": {
      "type": [
        "number",
        "null"
      ]
    },
    "cell_counts": {
      "type": "object"
    },
    "metrics": {
      "type": "object"
    }
  }
}